{
  "schema_version": "hsie-world-reference/0.1",
  "world_id": "BREVARD-COM-DEMO-001",
  "status": "PHASE15_PILOT_BUILD",
  "display_name": "Explore Brevard — Main Street Founding Pilot",
  "public_name_status": "PUBLIC_PILOT",
  "root_place_refs": [
    "place:hsa-arrival-hub"
  ],
  "topology_version": "5",
  "created_at": "2026-09-26T20:48:38Z",
  "updated_at": "2026-09-28T02:35:00Z"
}
