{
  "schema_version": "hsie-world-reference/0.1",
  "world_id": "world:brevard-reference",
  "status": "CANDIDATE",
  "display_name": "Brevard Reference World",
  "public_name_status": "TBD",
  "root_place_refs": [
    "place:brevard-demo-street"
  ],
  "topology_version": "1",
  "created_at": "2026-09-27T04:40:00Z",
  "updated_at": "2026-09-27T04:40:00Z"
}
